Symbol,Fund Name,Asset Class,Assets
AAA,AAF First Priority CLO Bond ETF,Fixed Income,7.33M
AAAU,Goldman Sachs Physical Gold ETF,Commodity,447.36M
AADR,AdvisorShares Dorsey Wright ADR ETF,Equity,33.27M
AAPB,GraniteShares 1.75x Long AAPL Daily ETF,Equity,585.70K
AAPD,Direxion Daily AAPL Bear 1X Shares,Equity,27.35M
AAPU,Direxion Daily AAPL Bull 1.5X Shares,Equity,7.19M
AAXJ,iShares MSCI All Country Asia ex Japan ETF,Equity,2.87B
ABEQ,Absolute Core Strategy ETF,Equity,87.98M
ACES,ALPS Clean Energy ETF,Equity,565.79M
ACIO,Aptus Collared Income Opportunity ETF,Equity,527.75M
ACSI,American Customer Satisfaction Core Alpha ETF,Equity,64.82M
ACTV,LeaderShares Activist Leaders ETF,Equity,92.71M
ACVF,American Conservative Values ETF,Equity,34.05M
ACWF,iShares Edge MSCI Multifactor Global ETF,Equity,115.36M
ACWI,iShares MSCI ACWI ETF,Equity,18.40B
ACWV,iShares Edge MSCI Min Vol Global ETF,Equity,4.60B
ACWX,iShares MSCI ACWI ex U.S. ETF,Equity,4.27B
ADFI,Anfield Dynamic Fixed Income ETF,Fixed Income,15.12M
ADIV,SmartETFs Asia Pacific Dividend Builder ETF,Equity,3.52M
ADME,APTUS Drawdown Managed Equity ETF,Equity,281.87M
ADPV,Adaptiv Select ETF,Equity,18.80M
ADRE,Invesco BLDRS Emerging Markets 50 ADR Index Fund,Equity,128.93M
AEMB,American Century Emerging Markets Bond ETF,Fixed Income,26.50M
AESR,Anfield Equity Sector Rotation ETF,Equity,97.81M
AFIF,Anfield Universal Fixed Income ETF,Fixed Income,115.28M
AFK,VanEck Vectors Africa Index ETF,Equity,46.83M
AFLG,First Trust Active Factor Large Cap ETF,Equity,4.63M
AFMC,First Trust Active Factor Mid Cap ETF,Equity,1.12M
AFSM,First Trust Active Factor Small Cap ETF,Equity,4.53M
AFTY,CSOP FTSE China A50 ETF,Equity,4.95M
AGG,iShares Core U.S. Aggregate Bond ETF,Fixed Income,83.34B
AGGH,Simplify Aggregate Bond PLUS Credit Hedge ETF,Fixed Income,1.80M
AGGY,WisdomTree Barclays Yield Enhanced U.S. Aggregate Bond Fund,Fixed Income,888.90M
AGIH,iShares Inflation Hedged U.S. Aggregate Bond ETF,Fixed Income,2.42M
AGNG,Global X Aging Population ETF,Equity,41.92M
AGOV,Gavekal Asian Government Bond ETF,Fixed Income,41.38M
AGOX,Adaptive Growth Opportunities ETF,Asset Allocation,165.02M
AGQ,ProShares Ultra Silver,Commodity,411.73M
AGRH,iShares Interest Rate Hedged U.S. Aggregate Bond ETF,Fixed Income,2.53M
AGZ,iShares Agency Bond ETF,Fixed Income,582.77M
AGZD,WisdomTree Barclays Interest Rate Hedged U.S. Aggregate Bond Fund,Fixed Income,293.46M
AHHX,Adaptive High Income ETF,Asset Allocation,26.10M
AHOY,Newday Ocean Health ETF,Equity,1.50M
AHYB,American Century Select High Yield ETF,Fixed Income,28.12M
AIA,iShares Asia 50 ETF,Equity,1.41B
AIEQ,AI Powered Equity ETF,Equity,93.84M
AILG,Alpha Intelligent - Large Cap Growth ETF,Equity,1.56M
AILV,Alpha Intelligent - Large Cap Value ETF,Equity,474.20K
AIQ,Global X Future Analytics Tech ETF,Equity,121.45M
AIRR,First Trust RBA American Industrial Renaissance ETF,Equity,221.35M
AIVI,WisdomTree International AI Enhanced Value Fund,Equity,76.92M
AIVL,WisdomTree U.S. AI Enhanced Value Fund,Equity,418.25M
ALTL,Pacer Lunt Large Cap Alternator ETF,Equity,1.01B
ALTY,Global X SuperDividend Alternatives ETF,Alternatives,37.56M
AMAX,RH Hedged Multi-Asset Income ETF,Asset Allocation,40.60M
AMID,Argent Mid Cap ETF,Equity,25.69M
AMLP,Alerian MLP ETF,Equity,6.25B
AMOM,QRAFT AI Enhanced U.S. Large Cap Momentum ETF,Equity,11.31M
AMZA,InfraCap MLP ETF,Equity,294.22M
AMZD,Direxion Daily AMZN Bear 1X Shares,Equity,6.80M
AMZU,Direxion Daily AMZN Bull 1.5X Shares,Equity,10.51M
ANEW,ProShares MSCI Transformational Changes ETF,Equity,13.59M
ANGL,VanEck Vectors Fallen Angel High Yield Bond ETF,Fixed Income,2.95B
AOA,iShares Core Aggressive Allocation ETF,Asset Allocation,1.70B
AOK,iShares Core Conservative Allocation ETF,Asset Allocation,914.91M
AOM,iShares Core Moderate Allocation ETF,Asset Allocation,1.58B
AOR,iShares Core Growth Allocation ETF,Asset Allocation,2.68B
AOTG,AOT Growth and Innovation ETF,Equity,17.48M
APRT,AllianzIM U.S. Large Cap Buffer10 Apr ETF,Equity,17.90M
APRW,AllianzIM U.S. Large Cap Buffer20 Apr ETF,Equity,62.71M
APRZ,TrueShares Structured Outcome (April) ETF,Equity,5.52M
APXH,APEX Healthcare ETF,Equity,3.95M
AQGX,AI Quality Growth ETF,Equity,29.52M
AQWA,Global X Clean Water ETF,Equity,8.21M
ARB,AltShares Merger Arbitrage ETF,Alternatives,85.15M
ARCM,Arrow Reserve Capital Management ETF,Fixed Income,50.62M
ARGT,Global X MSCI Argentina ETF,Equity,29.41M
ARKF,ARK FinTech Innovation ETF,Equity,665.79M
ARKG,ARK Genomic Revolution ETF,Equity,1.93B
ARKK,ARK Innovation ETF,Equity,6.13B
ARKQ,ARK Autonomous Technology & Robotics ETF,Equity,803.49M
ARKW,ARK Next Generation Internet ETF,Equity,965.92M
ARKX,ARK Space Exploration & Innovation ETF,Equity,260.42M
ARMR,Armor US Equity Index ETF,Equity,33.37M
ARP,PMV Adaptive Risk Parity ETF,Alternative,20.50M
ARVR,First Trust Indxx Metaverse ETF,Equity,1.24M
ASEA,Global X FTSE Southeast Asia ETF,Equity,47.24M
ASET,FlexShares Real Assets Allocation Index Fund,Equity,24.25M
ASHR,Xtrackers Harvest CSI 300 China A-Shares ETF,Equity,2.04B
ASHS,Xtrackers Harvest CSI 500 China A-Shares Small Cap ETF,Equity,24.68M
ASHX,Xtrackers MSCI China A Inclusion Equity ETF,Equity,5.51M
ASPY,ASYMshares ASYMmetric 500 ETF,Alternatives,26.09M
ATFV,Alger 35 ETF,Equity,8.89M
AUGZ,TrueShares Structured Outcome (August) ETF,Equity,12.91M
AUSF,Global X Adaptive U.S. Factor ETF,Equity,173.29M
AVDE,Avantis International Equity ETF,Equity,2.25B
AVDV,Avantis International Small Cap Value ETF,Equity,2.27B
AVEM,Avantis Emerging Markets Equity ETF,Equity,2.46B
AVES,Avantis Emerging Markets Value ETF,Equity,193.84M
AVGE,Avantis All Equity Markets ETF,Equity,81.62M
AVIE,Avantis Inflation Focused Equity ETF,Equity,19.36M
AVIG,Avantis Core Fixed Income ETF,Fixed Income,331.56M
AVIV,Avantis International Large Cap Value ETF,Equity,168.33M
AVLV,Avantis U.S. Large Cap Value ETF,Equity,763.24M
AVMU,Avantis Core Municipal Fixed Income ETF,Fixed Income,59.69M
AVRE,Avantis Real Estate ETF,Equity,243.46M
AVSC,Avantis U.S Small Cap Equity ETF,Equity,69.81M
AVSD,Avantis Responsible International Equity ETF,Equity,56.69M
AVSE,Avantis Responsible Emerging Markets Equity ETF,Equity,40.60M
AVSF,Avantis Short-Term Fixed Income ETF,Fixed Income,192.88M
AVSU,Avantis Responsible U.S. Equity ETF,Equity,82.18M
AVUS,Avantis U.S. Equity ETF,Equity,3.28B
AVUV,Avantis U.S. Small Cap Value ETF,Equity,4.73B
AWAY,ETFMG Travel Tech ETF,Equity,148.85M
AWYX,ETFMG 2x Daily Travel Tech ETF,Equity,250.50K
AZTD,Aztlan Global Stock Selection DM SMID ETF,Equity,8.82M
BAB,Invesco Taxable Municipal Bond ETF,Fixed Income,1.51B
BABX,GraniteShares 1.75x Long BABA Daily ETF,Equity,957.50K
BAD,B.A.D. ETF,Equity,8.85M
BALT,Innovator Defined Wealth Shield ETF,Equity,286.37M
BAPR,Innovator S&P 500 Buffer ETF (April),Equity,115.18M
BAR,Graniteshares Gold Trust,Commodity,914.29M
BATT,Amplify Advanced Battery Metals and Materials ETF,Equity,145.47M
BAUG,Innovator S&P 500 Buffer ETF (August),Equity,98.99M
BBAX,JPMorgan BetaBuilders Developed Asia ex-Japan ETF,Equity,4.04B
BBC,BioShares Biotechnology Clinical Trials ETF,Equity,17.60M
BBCA,JPMorgan BetaBuilders Canada ETF,Equity,5.74B
BBEU,JPMorgan BetaBuilders Europe ETF,Equity,3.24B
BBH,VanEck Vectors Biotech ETF,Equity,499.34M
BBIN,JPMorgan BetaBuilders International Equity ETF,Equity,2.88B
BBJP,JPMorgan BetaBuilders Japan ETF,Equity,6.66B
BBLU,EA Bridgeway Blue Chip ETF,Equity,144.10M
BBMC,JPMorgan BetaBuilders U.S. Mid Cap Equity ETF,Equity,1.32B
BBP,BioShares Biotechnology Products ETF,Equity,17.43M
BBRE,JPMorgan BetaBuilders MSCI US REIT ETF,Equity,863.72M
BBSA,JPMorgan BetaBuilders 1-5 Year U.S. Aggregate Bond ETF,Fixed Income,37.74M
BBSC,JPMorgan BetaBuilders U.S. Small Cap Equity ETF,Equity,522.59M
BBUS,JPMorgan BetaBuilders U.S. Equity ETF,Equity,1.28B
BCD,Aberdeen Standard Bloomberg All Commodity Longer Dated Strategy K-1 Free ETF,Commodity,269.46M
BCDF,Horizon Kinetics Blockchain Development ETF,Equity,1.99M
BCI,Aberdeen Standard Bloomberg All Commodity Strategy K-1 ETF,Commodity,832.63M
BCIM,Aberdeen Bloomberg Industrial Metals Strategy K-1 Free ETF,Commodity,30.94M
BDEC,Innovator S&P 500 Buffer ETF (December),Equity,97.48M
BDRY,Breakwave Dry Bulk Shipping ETF,Commodity,36.49M
BECO,BlackRock Future Climate and Sustainable Economy ETF,Equity,4.05M
BEDZ,AdvisorShares Hotel ETF,Equity,4.52M
BETZ,Roundhill Sports Betting & iGaming ETF,Equity,128.42M
BFEB,Innovator S&P 500 Buffer ETF (February),Equity,66.59M
BFIT,Global X Health & Wellness Thematic ETF,Equity,22.82M
BFIX,Build Bond Innovation ETF,Fixed Income,31.55M
BFOR,Barron's 400 ETF,Equity,125.45M
BFTR,BlackRock Future Innovators ETF,Equity,7.27M
BGLD,FT Cboe Vest Gold Strategy Quarterly Buffer ETF,Commodity,13.01M
BGRN,iShares Global Green Bond ETF,Fixed Income,294.39M
BIB,ProShares Ultra Nasdaq Biotechnology,Equity,104.74M
BIBL,Inspire 100 ETF,Equity,273.52M
BICK,First Trust BICK Index Fund,Equity,13.83M
BIDS,Amplify Digital and Online Trading ETF,Equity,381.50K
BIL,SPDR Bloomberg Barclays 1-3 Month T-Bill ETF,Fixed Income,26.48B
BILS,SPDR Bloomberg Barclays 3-12 Month T-Bill ETF,Fixed Income,650.14M
BIS,ProShares UltraShort Nasdaq Biotechnology,Equity,6.83M
BITI,ProShares Short Bitcoin Strategy ETF,Currency,99.18M
BITO,ProShares Bitcoin Strategy ETF,Currency,553.22M
BITQ,Bitwise Crypto Industry Innovators ETF,Equity,37.72M
BITS,Blockchain & Bitcoin Strategy ETF,Asset Allocation,7.06M
BIV,Vanguard Intermediate-Term Bond Fund,Fixed Income,12.78B
BIZD,VanEck Vectors BDC Income ETF,Equity,529.30M
BJAN,Innovator S&P 500 Buffer ETF (January),Equity,139.69M
BJK,VanEck Vectors Gaming ETF,Equity,100.40M
BJUL,Innovator S&P 500 Buffer ETF (July),Equity,169.28M
BJUN,Innovator S&P 500 Buffer ETF (June),Equity,74.06M
BKAG,BNY Mellon Core Bond ETF,Fixed Income,412.29M
BKCH,Global X Blockchain ETF,Equity,39.39M
BKCI,BNY Mellon Concentrated International ETF,Equity,64.15M
BKEM,BNY Mellon Emerging Markets Equity ETF,Equity,30.34M
BKES,BNY Mellon Sustainable Global Emerging Markets ETF,Equity,9.75M
BKF,iShares MSCI BRIC ETF,Equity,81.84M
BKGI,BNY Mellon Global Infrastructure Income ETF,Equity,10.88M
BKHY,BNY Mellon High Yield Beta ETF,Fixed Income,51.25M
BKIE,BNY Mellon International Equity ETF,Equity,149.20M
BKIS,BNY Mellon Sustainable International Equity ETF,Equity,8.09M
BKLC,BNY Mellon US Large Cap Core Equity ETF,Equity,429.59M
BKLN,Invesco Senior Loan ETF,Fixed Income,4.02B
BKMC,BNY Mellon US Mid Cap Core Equity ETF,Equity,91.16M
BKSB,BNY Mellon Short Duration Corporate Bond ETF,Fixed Income,53.89M
BKSE,BNY Mellon US Small Cap Core Equity ETF,Equity,33.69M
BKUI,BNY Mellon Ultra Short Income ETF,Fixed Income,26.87M
BKUS,BNY Mellon Sustainable US Equity ETF,Equity,7.83M
BLCN,Reality Shares Nasdaq NexGen Economy ETF,Equity,90.31M
BLDG,Cambria Global Real Estate ETF,Equity,23.87M
BLES,Inspire Global Hope ETF,Equity,136.80M
BLHY,Virtus Newfleet Dynamic Credit ETF,Fixed Income,4.15M
BLKC,Invesco Alerian Galaxy Blockchain Users and Decentralized Commerce ETF,Equity,-
BLLD,JPMorgan Sustainable Infrastructure ETF,Equity,10.28M
BLOK,Amplify Transformational Data Sharing ETF,Equity,369.60M
BLV,Vanguard Long-Term Bond ETF,Fixed Income,4.20B
BMAR,Innovator S&P 500 Buffer ETF (March),Equity,73.59M
BMAY,Innovator S&P 500 Buffer ETF (May),Equity,170.00M
BMED,BlackRock Future Health ETF,Equity,5.59M
BND,Vanguard Total Bond Market ETF,Fixed Income,83.56B
BNDC,FlexShares Core Select Bond Fund,Fixed Income,166.30M
BNDD,Quadratic Deflation ETF,Fixed Income,31.94M
BNDI,NEOS Enhanced Income Aggregate Bond ETF,Fixed Income,959.20K
BNDW,Vanguard Total World Bond ETF,Fixed Income,561.37M
BNDX,Vanguard Total International Bond ETF,Fixed Income,45.13B
BNE,Blue Horizon BNE ETF,Equity,6.55M
BNGE,First Trust S-Network Streaming and Gaming ETF,Equity,3.50M
BNO,United States Brent Oil Fund,Commodity,210.05M
BNOV,Innovator S&P 500 Buffer ETF (November),Equity,133.21M
BOAT,SonicShares Global Shipping ETF,Equity,19.33M
BOCT,Innovator S&P 500 Buffer ETF (October),Equity,229.32M
BOIL,ProShares Ultra Bloomberg Natural Gas,Commodity,453.91M
BOND,PIMCO Total Return Active ETF,Fixed Income,3.24B
BOSS,Global X Founder-Run Companies ETF,Equity,7.34M
BOTZ,Global X Robotics & Artificial Intelligence ETF,Equity,1.32B
BOUT,Innovator IBD Breakout Opportunities ETF,Equity,13.30M
BPAY,BlackRock Future Financial and Technology ETF,Equity,4.14M
BRF,VanEck Vectors Brazil Small-Cap ETF,Equity,23.58M
BRKY,Direxion Breakfast Commodities Strategy ETF,Commodity,9.01M
BRLN,BlackRock Floating Rate Loan ETF,Fixed Income,20.40M
BRNY,Burney U.S. Factor Rotation ETF,Equity,141.91M
BRZU,Direxion Daily MSCI Brazil Bull 2X Shares,Equity,106.04M
BSBE,Invesco BulletShares 2022 USD Emerging Markets Debt ETF,Fixed Income,16.67M
BSCE,Invesco BulletShares 2023 USD Emerging Markets Debt ETF,Fixed Income,25.65M
BSCM,Invesco BulletShares 2022 Corporate Bond ETF,Fixed Income,1.68B
BSCN,Invesco BulletShares 2023 Corporate Bond ETF,Fixed Income,2.73B
BSCO,Invesco BulletShares 2024 Corporate Bond ETF,Fixed Income,3.76B
BSCP,Invesco BulletShares 2025 Corporate Bond ETF,Fixed Income,1.95B
BSCQ,Invesco BulletShares 2026 Corporate Bond ETF,Fixed Income,1.49B
BSCR,Invesco BulletShares 2027 Corporate Bond ETF,Fixed Income,696.01M
BSCS,Invesco BulletShares 2028 Corporate Bond ETF,Fixed Income,441.86M
BSCT,Invesco BulletShares 2029 Corporate Bond ETF,Fixed Income,196.22M
BSCU,Invesco BulletShares 2030 Corporate Bond ETF,Fixed Income,145.62M
BSCV,Invesco BulletShares 2031 Corporate Bond ETF,Fixed Income,62.32M
BSCW,Invesco BulletShares 2032 Corporate Bond ETF,Fixed Income,18.17M
BSDE,Invesco BulletShares 2024 USD Emerging Markets Debt ETF,Fixed Income,36.20M
BSEA,ETFMG Breakwave Sea Decarbonization Tech ETF,Equity,2.07M
BSEP,Innovator S&P 500 Buffer ETF (September),Equity,167.28M
BSJM,Invesco BulletShares 2022 High Yield Corporate Bond ETF,Fixed Income,506.23M
BSJN,Invesco BulletShares 2023 High Yield Corporate Bond ETF,Fixed Income,731.95M
BSJO,Invesco BulletShares 2024 High Yield Corporate Bond ETF,Fixed Income,505.30M
BSJP,Invesco BulletShares 2025 High Yield Corporate Bond ETF,Fixed Income,424.98M
BSJQ,Invesco BulletShares 2026 High Yield Corporate Bond ETF,Fixed Income,224.86M
BSJR,Invesco BulletShares 2027 High Yield Corporate Bond ETF,Fixed Income,67.01M
BSJS,Invesco BulletShares 2028 High Yield Corporate Bond ETF,Fixed Income,29.30M
BSJT,Invesco BulletShares 2029 High Yield Corporate Bond ETF,Fixed Income,12.13M
BSJU,Invesco BulletShares 2030 High Yield Corporate Bond ETF,Fixed Income,4.91M
BSMM,Invesco BulletShares Municipal Bond 2022 Index,Fixed Income,80.74M
BSMN,Invesco BulletShares 2023 Municipal Bond ETF,Fixed Income,145.96M
BSMO,Invesco BulletShares 2024 Municipal Bond ETF,Fixed Income,153.74M
BSMP,Invesco BulletShares 2025 Municipal Bond ETF,Fixed Income,124.62M
BSMQ,Invesco BulletShares 2026 Municipal Bond ETF,Fixed Income,85.00M
BSMR,Invesco BulletShares 2027 Municipal Bond ETF,Fixed Income,68.54M
BSMS,Invesco BulletShares 2028 Municipal Bond ETF,Fixed Income,53.74M
BSMT,Invesco BulletShares Municipal Bond 2029 Index,Fixed Income,41.46M
BSMU,Invesco BulletShares 2030 Municipal Bond ETF,Fixed Income,32.72M
BSMV,Invesco BulletShares 2031 Municipal Bond ETF,Fixed Income,12.57M
BSTP,Innovator Buffer Step-Up Strategy ETF,Equity,29.55M
BSV,Vanguard Short-Term Bond ETF,Fixed Income,37.63B
BTAL,AGFiQ US Market Neutral Anti-Beta Fund,Alternatives,393.95M
BTCR,Volt Crypto Industry Revolution and Tech ETF,Equity,1.82M
BTEC,Principal Healthcare Innovators Index ETF,Equity,55.13M
BTEK,BlackRock Future Tech ETF,Equity,10.41M
BTF,Valkyrie Bitcoin Strategy ETF,Currency,19.40M
BTHM,BlackRock Future U.S. Themes ETF,Equity,4.11M
BUCK,Simplify Stable Income ETF,Fixed Income,3.26M
BUFB,Innovator Laddered Allocation Buffer ETF,Equity,35.05M
BUFD,FT Cboe Vest Fund of Deep Buffer ETF,Equity,517.91M
BUFF,Innovator Laddered Fund of S&P 500 Power Buffer ETF,Equity,172.40M
BUFG,FT Cboe Vest Buffered Allocation Growth ETF,Equity,151.11M
BUFQ,FT Cboe Vest Fund of Nasdaq-100 Buffer ETF,Equity,-
BUFR,FT Cboe Vest Fund of Buffer ETFs,Equity,768.12M
BUFT,FT Cboe Vest Buffered Allocation Defensive ETF,Equity,135.68M
BUG,Global X Cybersecurity ETF,Equity,845.82M
BUL,Pacer US Cash Cows Growth ETF,Equity,38.69M
BULD,Pacer BlueStar Engineering the Future ETF,Equity,1.42M
BUYW,Main BuyWrite ETF,Equity,162.56M
BUYZ,Franklin Disruptive Commerce ETF,Equity,8.47M
BUZZ,VanEck Vectors Social Sentiment ETF,Equity,52.79M
BWEB,Bitwise Web3 ETF,Equity,1.30M
BWX,SPDR Bloomberg Barclays International Treasury Bond ETF,Fixed Income,1.12B
BWZ,SPDR Bloomberg Barclays Short Term International Treasury Bond ETF,Fixed Income,144.93M
BYLD,iShares Yield Optimized Bond ETF,Fixed Income,100.41M
BYOB,SoFi Be Your Own Boss ETF,Equity,7.45M
BYRE,Principal Real Estate Active Opportunities ETF,Equity,5.02M
BYTE,Roundhill IO Digital Infrastructure ETF,Equity,2.96M
BZQ,ProShares UltraShort MSCI Brazil Capped,Equity,18.25M
CACG,ClearBridge All Cap Growth ETF,Equity,123.24M
CALF,Pacer US Small Cap Cash Cows 100 ETF,Equity,1.38B
CANE,Teucrium Sugar Fund,Commodity,23.94M
CAPE,DoubleLine Shiller CAPE U.S. Equities ETF,Equity,246.00M
CARY,Angel Oak Income ETF,Fixed Income,31.08M
CARZ,First Trust Nasdaq Global Auto Index Fund,Equity,39.50M
CATH,Global X S&P 500 Catholic Values ETF,Equity,563.05M
CBLS,Changebridge Capital Long/Short Equity ETF,Alternatives,5.10M
CBON,VanEck Vectors ChinaAMC China Bond ETF,Fixed Income,56.76M
CBSE,Changebridge Capital Sustainable Equity ETF,Equity,5.59M
CCOR,Cambria Core Equity ETF,Alternatives,589.04M
CCRV,iShares Commodity Curve Carry Strategy ETF,Commodity,26.88M
CCSO,Carbon Collective Climate Solutions U.S. Equity ETF,Equity,14.82M
CDC,VictoryShares US EQ Income Enhanced Volatility Wtd ETF,Equity,2.07B
CDL,VictoryShares US Large Cap High Div Volatility Wtd ETF,Equity,368.42M
CDX,Simplify High Yield PLUS Credit Hedge ETF,Fixed Income,39.99M
CEFA,Global X S&P Catholic Values Developed ex-U.S. ETF,Equity,6.28M
CEFS,Saba Closed-End Funds ETF,Asset Allocation,89.85M
CEMB,iShares J.P. Morgan Emerging Markets Corporate Bond ETF,Fixed Income,298.43M
CEW,WisdomTree Emerging Currency Strategy Fund,Currency,8.43M
CEY,VictoryShares Emerging Market High Div Volatility Wtd ETF,Equity,9.29M
CFA,VictoryShares US 500 Volatility Wtd ETF,Equity,581.32M
CFCV,ClearBridge Focus Value ETF,Equity,2.74M
CFO,VictoryShares US 500 Enhanced Volatility Wtd ETF,Equity,844.46M
CGCP,Capital Group Core Plus Income ETF,Fixed Income,459.87M
CGDV,Capital Group Dividend Value ETF,Equity,1.43B
CGGO,Capital Group Global Growth Equity ETF,Equity,1.05B
CGGR,Capital Group Growth ETF,Equity,1.26B
CGMS,Capital Group U.S. Multi-Sector Income ETF,Fixed Income,72.46M
CGMU,Capital Group Municipal Income ETF,Fixed Income,73.50M
CGSD,Capital Group Short Duration Income ETF,Fixed Income,81.01M
CGUS,Capital Group Core Equity ETF,Equity,568.05M
CGV,Conductor Global Equity Value ETF,Equity,104.20M
CGW,Invesco S&P Global Water Index ETF,Equity,972.48M
CGXU,Capital Group International Focus Equity ETF,Equity,904.13M
CHAD,Direxion Daily CSI 300 China A Share Bear 1X Shares,Equity,15.89M
CHAU,Direxion Daily CSI 300 China A Share Bull 2X Shares,Equity,65.24M
CHB,China Biotech Innovation ETF,Equity,2.72M
CHGX,Change Finance Diversified Impact US Large Cap Fossil Fuel Free ETF,Equity,108.50M
CHIC,Global X MSCI China Communication Services ETF,Equity,7.63M
CHIE,Global X China Energy ETF,Equity,8.79M
CHIH,Global X MSCI China Health Care ETF,Equity,12.51M
CHII,Global X China Industrials ETF,Equity,6.01M
CHIK,Global X MSCI China Information Technology ETF,Equity,15.45M
CHIM,Global X China Materials ETF,Equity,3.93M
CHIQ,Global X China Consumer ETF,Equity,309.67M
CHIR,Global X MSCI China Real Estate ETF,Equity,6.99M
CHIS,Global X MSCI Consumer Staples ETF,Equity,39.74M
CHIU,Global X MSCI China Utilities ETF,Equity,2.73M
CHIX,Global X China Financials ETF,Equity,29.08M
CHNA,Loncar China BioPharma ETF,Equity,6.23M
CIBR,First Trust Nasdaq Cybersecurity ETF,Equity,4.51B
CID,VictoryShares International High Div Volatility Wtd ETF,Equity,16.51M
CIL,VictoryShares International Volatility Wtd ETF,Equity,88.24M
CIRC,JPMorgan Sustainable Consumption ETF,Equity,10.87M
CIZ,VictoryShares Developed Enhanced Volatility Wtd ETF,Equity,46.66M
CLDL,Direxion Daily Cloud Computing Bull 2X Shares,Equity,6.79M
CLIX,ProShares Long Online/Short Stores ETF,Equity,12.35M
CLNR,IQ Cleaner Transport ETF,Equity,4.60M
CLOI,VanEck CLO ETF,Fixed Income,25.26M
CLOU,Global X Cloud Computing ETF,Equity,544.31M
CLRG,IQ Chaikin U.S. Large Cap ETF,Equity,278.47M
CLSA,Cabana Target Leading Sector Aggressive ETF,Asset Allocation,230.99M
CLSC,Cabana Target Leading Sector Conservative ETF,Asset Allocation,58.21M
CLSE,Convergence Long/Short Equity ETF,Alternatives,23.65M
CLSM,Cabana Target Leading Sector Moderate ETF,Asset Allocation,32.49M
CLTL,Invesco Treasury Collateral ETF,Fixed Income,1.01B
CMBS,iShares CMBS ETF,Fixed Income,569.59M
CMDY,iShares Bloomberg Roll Select Commodity Strategy ETF,Commodity,349.91M
CMF,iShares California Muni Bond ETF,Fixed Income,1.99B
CN,Xtrackers MSCI All China Equity ETF,Equity,7.36M
CNBS,Amplify Seymour Cannabis ETF,Equity,32.09M
CNCR,Loncar Cancer Immunotherapy ETF,Equity,20.93M
CNRG,SPDR Kensho Clean Power ETF,Equity,329.70M
CNXT,VanEck Vectors ChinaAMC SME-ChiNext ETF,Equity,20.47M
CNYA,iShares MSCI China A ETF,Equity,320.82M
COM,Direxion Auspice Broad Commodity Strategy ETF,Commodity,71.30M
COMB,GraniteShares Bloomberg Commodity Broad Strategy No K-1 ETF,Commodity,178.75M
COMT,iShares Commodities Select Strategy ETF,Commodity,1.70B
CONL,GraniteShares 1.5x Long Coinbase Daily ETF,Equity,961.40K
COPX,Global X Copper Miners ETF,Equity,1.71B
CORN,Teucrium Corn Fund,Commodity,147.98M
CORP,PIMCO Investment Grade Corporate Bond Index ETF,Fixed Income,905.56M
COWZ,Pacer US Cash Cows 100 ETF,Equity,10.28B
CPER,United States Copper Index Fund,Commodity,166.51M
CPI,IQ Real Return ETF,Alternatives,9.84M
CPII,Ionic Inflation Protection ETF,Fixed Income,9.81M
CQQQ,Invesco China Technology ETF,Equity,972.17M
CRAK,VanEck Vectors Oil Refiners ETF,Equity,38.04M
CRBN,iShares MSCI ACWI Low Carbon Target ETF,Equity,829.21M
CRIT,Optica Rare Earths & Critical Materials ETF,Equity,2.18M
CRPT,First Trust SkyBridge Crypto Industry and Digital Economy ETF,Equity,14.90M
CRUZ,"Defiance Hotel, Airline, and Cruise ETF",Equity,49.26M
CRYP,AdvisorShares Managed Bitcoin Strategy ETF,Asset Allocation,122.20K
CSA,VictoryShares US Small Cap Volatility Wtd ETF,Equity,23.48M
CSB,VictoryShares US Small Cap High Div Volatility Wtd ETF,Equity,373.46M
CSD,Invesco S&P Spin-Off ETF,Equity,53.15M
CSF,VictoryShares US Discovery Enhanced Volatility Wtd ETF,Equity,90.68M
CSH,Exos Active SPAC Arbitrage ETF,Equity,8.14M
CSHI,NEOS Enhanced Income Cash Alternative ETF,Fixed Income,5.00M
CSM,ProShares Large Cap Core Plus,Equity,418.27M
CSML,IQ Chaikin U.S. Small Cap ETF,Equity,251.16M
CTA,Simplify Managed Futures Strategy ETF,Alternatives,157.77M
CTEC,Global X CleanTech ETF,Equity,116.54M
CTEX,ProShares S&P Kensho Cleantech ETF,Equity,5.22M
CUBS,Asian Growth Cubs ETF,Equity,10.29M
CURE,Direxion Daily Healthcare Bull 3x Shares,Equity,210.54M
CUT,Invesco MSCI Global Timber ETF,Equity,60.62M
CVAR,Cultivar ETF,Equity,23.54M
CVY,Invesco Zacks Multi-Asset Income ETF,Asset Allocation,97.93M
CWB,SPDR Bloomberg Barclays Convertible Securities ETF,Fixed Income,4.18B
CWEB,Direxion Daily CSI China Internet Index Bull 2X Shares,Equity,421.37M
CWI,SPDR MSCI ACWI ex-US ETF,Equity,1.58B
CWS,AdvisorShares Focused Equity ETF,Equity,32.62M
CXSE,WisdomTree China ex-State-Owned Enterprises Fund,Equity,862.58M
CYA,Simplify Tail Risk Strategy ETF,Asset Allocation,23.78M
CYB,WisdomTree Chinese Yuan Strategy Fund,Currency,27.74M
CZA,Invesco Zacks Mid-Cap ETF,Equity,209.52M
DALI,First Trust Dorsey Wright DALI 1 ETF,Asset Allocation,134.82M
DALT,Anfield Diversified Alternatives ETF,Alternatives,56.51M
DAM,VanEck Digital Assets Mining ETF,Equity,660.00K
DAPP,VanEck Vectors Digital Transformation ETF,Equity,19.70M
DAPR,FT Cboe Vest U.S. Equity Deep Buffer ETF (April),Equity,304.39M
DAT,ProShares Big Data Refiners ETF,Equity,1.72M
DAUG,FT Cboe Vest U.S. Equity Deep Buffer ETF (August),Equity,321.57M
DAX,Horizons DAX Germany ETF,Equity,46.07M
DBA,Invesco DB Agriculture Fund,Commodity,1.06B
DBAW,Deutsche X-trackers MSCI All World ex US Hedged Equity ETF,Equity,127.05M
DBB,Invesco DB Base Metals Fund,Commodity,228.61M
DBC,Invesco DB Commodity Index Tracking Fund,Commodity,2.54B
DBE,Invesco DB Energy Fund,Commodity,147.25M
DBEF,Deutsche X-trackers MSCI EAFE Hedged Equity ETF,Equity,3.74B
DBEH,iM DBi Hedge Strategy ETF,Alternatives,15.63M
DBEM,Deutsche X-trackers MSCI Emerging Markets Hedged Equity ETF,Equity,91.23M
DBEU,Deutsche X-trackers MSCI Europe Hedged Equity ETF,Equity,472.31M
DBEZ,Deutsche X-trackers MSCI Eurozone Hedged Equity ETF,Equity,10.82M
DBGR,Deutsche X-trackers MSCI Germany Hedged Equity ETF,Equity,8.33M
DBJA,Innovator Double Stacker 9 Buffer ETF (January),Equity,6.27M
DBJP,Deutsche X-trackers MSCI Japan Hedged Equity ETF,Equity,229.22M
DBMF,iM DBi Managed Futures Strategy ETF,Alternatives,921.75M
DBND,DoubleLine Opportunistic Bond ETF,Fixed Income,59.00M
DBO,Invesco DB Oil Fund,Commodity,284.59M
DBOC,Innovator Double Stacker 9 Buffer ETF (October),Equity,13.85M
DBP,Invesco DB Precious Metals Fund,Commodity,111.66M
DBS,Invesco DB Silver Fund,Commodity,42.47M
DBV,Invesco DB G10 Currency Harvest Fund,Alternatives,37.96M
DDEC,FT Cboe Vest U.S. Equity Deep Buffer ETF (December),Equity,258.65M
DDIV,First Trust Dorsey Wright Momentum & Dividend ETF,Equity,65.60M
DDLS,WisdomTree Dynamic Currency Hedged International SmallCap Equity Fund,Equity,121.84M
DDM,ProShares Ultra Dow30,Equity,363.70M
DDWM,WisdomTree Dynamic Currency Hedged International Equity Fund,Equity,222.60M
DECT,AllianzIM U.S. Large Cap Buffer10 Dec ETF,Equity,18.04M
DECW,AllianzIM U.S. Large Cap Buffer20 Dec ETF,Equity,83.39M
