Symbol,Fund Name,Asset Class,Assets
MSOX,AdvisorShares MSOS 2x Daily ETF,Equity,4.28M
MSTB,Lha Market State Tactical Beta ETF,Equity,177.13M
MSTQ,LHA Market State Tactical Q ETF,Equity,3.38M
MSVX,LHA Market State Alpha Seeker ETF,Alternatives,43.83M
MTGP,WisdomTree Mortgage Plus Bond Fund,Fixed Income,21.80M
MTUM,iShares Edge MSCI USA Momentum Factor ETF,Equity,11.85B
MTVR,Fount Metaverse ETF,Equity,6.63M
MUB,iShares National Muni Bond ETF,Fixed Income,32.05B
MUNI,PIMCO Intermediate Municipal Bond Active ETF,Fixed Income,995.40M
MUSI,American Century Multisector Income ETF,Fixed Income,145.94M
MUST,Columbia Multi-Sector Municipal Income ETF,Fixed Income,281.21M
MVPS,Amplify Thematic All-Stars ETF,Equity,3.28M
MVV,ProShares Ultra MidCap400,Equity,128.10M
MXI,iShares Global Materials ETF,Equity,299.80M
MYY,ProShares Short MidCap400,Equity,15.47M
MZZ,ProShares UltraShort MidCap400,Equity,4.49M
NACP,NAACP Minority Empowerment ETF,Equity,34.41M
NAIL,Direxion Daily Homebuilders & Supplies Bull 3X Shares,Equity,149.60M
NANR,SPDR S&P North American Natural Resources ETF,Equity,689.33M
NAPR,Innovator Nasdaq-100 Power Buffer ETF (April),Equity,47.57M
NBCC,Neuberger Berman Next Generation Connected Consumer ETF,Equity,6.25M
NBCM,Neuberger Berman Commodity Strategy ETF,Commodity,207.89M
NBCT,Neuberger Berman Carbon Transition Infrastructure ETF,Equity,5.50M
NBDS,Neuberger Berman Disrupters ETF,Equity,18.75M
NDIV,Amplify Natural Resources Dividend Income ETF,Equity,3.32M
NDJI,Nationwide Dow Jones Risk-Managed Income ETF,Equity,29.17M
NDVG,Nuveen Dividend Growth ETF,Equity,7.62M
NEAR,iShares Short Maturity Bond ETF,Fixed Income,4.06B
NERD,Roundhill BITKRAFT Esports & Digital Entertainment ETF,Equity,25.24M
NETL,NETLease Corporate Real Estate ETF,Equity,94.83M
NETZ,Engine No. 1 Transform Climate ETF,Equity,87.24M
NFLT,Virtus Newfleet Multi-Sector Unconstrained Bond ETF,Fixed Income,67.11M
NFRA,FlexShares STOXX Global Broad Infrastructure Index Fund,Equity,2.46B
NFTY,First Trust India NIFTY 50 Equal Weight ETF,Equity,74.26M
NFTZ,Defiance Digital Revolution ETF,Equity,4.20M
NGE,Global X MSCI Nigeria ETF,Equity,38.57M
NIWM,NightShares 2000 ETF,Equity,6.33M
NJAN,Nasdaq-100 Power Buffer ETF (January),Equity,68.92M
NJUL,Nasdaq-100 Power Buffer ETF (July),Equity,112.47M
NKEL,AXS 2X NKE Bull Daily ETF,Equity,1.66M
NKEQ,AXS 2X NKE Bear Daily ETF,Equity,1.36M
NLR,VanEck Vectors Uranium Plus Nuclear Energy ETF,Equity,54.14M
NOBL,ProShares S&P 500 Dividend Aristocrats ETF,Equity,11.22B
NOCT,Innovator Nasdaq-100 Power Buffer ETF (October),Equity,97.73M
NOPE,Noble Absolute Return ETF,Alternatives,38.01M
NORW,Global X MSCI Norway ETF,Equity,96.60M
NOVZ,TrueShares Structured Outcome (November) ETF,Equity,9.64M
NSCS,Nuveen Small Cap Select ETF,Equity,5.39M
NSPI,Nationwide S&P 500 Risk-Managed Income ETF,Equity,27.24M
NSPL,NightShares 500 1x/1.5x ETF,Equity,3.06M
NSPY,NightShares 500 ETF,Equity,3.88M
NTKI,Nationwide Russell 2000 Risk-Managed Income ETF,Equity,12.72M
NTSE,WisdomTree Emerging Markets Efficient Core Fund,Asset Allocation,41.32M
NTSI,WisdomTree International Efficient Core Fund,Asset Allocation,197.28M
NTSX,WisdomTree 90/60 U.S. Balanced Fund,Asset Allocation,720.50M
NTZG,Nuveen Global Net Zero Transition ETF,Equity,5.19M
NUAG,NuShares Enhanced Yield U.S. Aggregate Bond ETF,Fixed Income,33.08M
NUBD,NuShares ESG U.S. Aggregate Bond ETF,Fixed Income,244.41M
NUDM,NuShares ESG International Developed Markets Equity ETF,Equity,306.82M
NUDV,Nuveen ESG Dividend ETF,Equity,9.73M
NUEM,NuShares ESG Emerging Markets Equity ETF,Equity,216.97M
NUGO,Nuveen Growth Opportunities ETF,Equity,2.06B
NUGT,Direxion Daily Gold Miners Bull 2X Shares,Equity,561.00M
NUHY,Nuveen ESG High Yield Corporate Bond ETF,Fixed Income,99.78M
NULC,Nuveen ESG Large-Cap ETF,Equity,22.63M
NULG,NuShares ESG Large-Cap Growth ETF,Equity,791.83M
NULV,NuShares ESG Large-Cap Value ETF,Equity,1.56B
NUMG,NuShares ESG Mid-Cap Growth ETF,Equity,344.06M
NUMV,NuShares ESG Mid-Cap Value ETF,Equity,327.89M
NURE,NuShares Short-Term REIT ETF,Equity,66.95M
NUSA,NuShares Enhanced Yield 1-5 Year U.S. Aggregate Bond ETF,Fixed Income,31.83M
NUSC,NuShares ESG Small-Cap ETF,Equity,904.53M
NUSI,Nationwide Risk-Managed Income ETF,Equity,476.61M
NVBT,AllianzIM U.S. Large Cap Buffer10 Nov ETF,Equity,16.35M
NVBW,AllianzIM U.S. Large Cap Buffer20 Nov ETF,Equity,35.29M
NVDL,GraniteShares 1.5x Long NVDA Daily ETF,Equity,569.80K
NVDS,AXS 1.25X NVDA Bear Daily ETF,Equity,7.80M
NVQ,QRAFT AI-Enhanced U.S. Next Value ETF,Equity,4.71M
NWLG,Nuveen Winslow Large-Cap Growth ESG ETF,Equity,4.33M
NXTE,AXS Green Alpha ETF,Equity,53.56M
NXTG,First Trust NASDAQ Smartphone Index Fund,Equity,450.22M
NYF,iShares New York Muni Bond ETF,Fixed Income,547.00M
NZAC,SPDR MSCI ACWI Climate Paris Aligned ETF,Equity,225.74M
NZRO,Strategy Shares Halt Climate Change ETF,Equity,1.03M
NZUS,SPDR MSCI USA Climate Paris Aligned ETF,Equity,86.74M
OACP,OneAscent Core Plus Bond ETF,Fixed Income,103.60M
OAEM,OneAscent Emerging Markets ETF,Equity,22.65M
OAIA,Teucrium AiLA Long-Short Agriculture Strategy ETF,Alternatives,5.01M
OAIE,Optimize AI Smart Sentiment EventDriven ETF,Alternatives,521.80K
OAIM,OneAscent International Equity ETF,Equity,55.64M
OALC,OneAscent Large Cap Core ETF,Equity,55.81M
OARK,YieldMax Innovation Option Income Strategy ETF,Equity,532.70K
OBIL,US Treasury 12 Month Bill ETF,Fixed Income,9.52M
OBND,SPDR Loomis Sayles Opportunistic Bond ETF,Fixed Income,33.26M
OBOR,KraneShares MSCI One Belt One Road ETF,Equity,4.60M
OCEN,IQ Clean Oceans ETF,Equity,5.92M
OCIO,ClearShares OCIO ETF,Asset Allocation,127.41M
OCTT,AllianzIM U.S. Large Cap Buffer10 Oct ETF,Equity,66.20M
OCTW,AllianzIM U.S. Large Cap Buffer20 Oct ETF,Equity,157.54M
OCTZ,TrueShares Structured Outcome (October) ETF,Equity,4.38M
ODDS,Pacer BlueStar Digital Entertainment ETF,Equity,679.30K
OEF,iShares S&P 100 ETF,Equity,7.14B
OEUR,O'Shares FTSE Europe Quality Dividend ETF,Equity,41.38M
OGIG,O'Shares Global Internet Giants ETF,Equity,191.43M
OIH,VanEck Vectors Oil Services ETF,Equity,2.45B
OILK,ProShares K-1 Free Crude Oil Strategy ETF,Commodity,94.16M
OMFL,Oppenheimer Russell 1000 Dynamic Multifactor ETF,Equity,2.24B
OMFS,Oppenheimer Russell 2000 Dynamic Multifactor ETF,Equity,211.91M
OND,ProShares On-Demand ETF,Equity,1.01M
ONEO,SPDR Russell 1000 Momentum Focus ETF,Equity,291.39M
ONEQ,Fidelity Nasdaq Composite Index ETF,Equity,3.66B
ONEV,SPDR Russell 1000 Low Volatility Focus ETF,Equity,567.29M
ONEY,SPDR Russell 1000 Yield Focus ETF,Equity,877.09M
ONG,Direxion Daily Oil Services Bull 2X Shares,Equity,10.21M
ONLN,ProShares Online Retail ETF,Equity,119.97M
ONOF,Global X Adaptive U.S. Risk Management ETF,Asset Allocation,66.79M
OOTO,Direxion Daily Travel & Vacation Bull 2X Shares,Equity,19.22M
OPER,ClearShares Ultra-Short Maturity ETF,Fixed Income,240.34M
OPPX,Corbett Road Tactical Opportunity ETF,Asset Allocation,15.75M
ORFN,Constrained Capital ESG Orphans ETF,Equity,2.06M
OSCV,Opus Small Cap Value Plus ETF,Equity,223.44M
OSEA,Harbor International Compounders ETF,Equity,7.08M
OUNZ,Vaneck Merk Gold Trust,Commodity,612.13M
OUSA,O'Shares FTSE US Quality Dividend ETF,Equity,771.21M
OUSM,O'Shares FTSE Russell US Small Cap Quality Dividend ETF,Equity,179.66M
OVB,Overlay Shares Core Bond ETF,Fixed Income,46.92M
OVF,Overlay Shares Foreign Equity ETF,Equity,12.77M
OVL,Overlay Shares Large Cap Equity ETF,Equity,206.82M
OVLH,Overlay Shares Hedged Large Cap Equity ETF,Equity,57.08M
OVM,Overlay Shares Municipal Bond ETF,Fixed Income,15.15M
OVS,Overlay Shares Small Cap Equity ETF,Equity,7.21M
OVT,Overlay Shares Short Term Bond ETF,Fixed Income,53.10M
OWNS,Impact Shares Affordable Housing MBS ETF,Fixed Income,102.34M
PAB,PGIM Active Aggregate Bond ETF,Fixed Income,41.91M
PABU,iShares Paris-Aligned Climate MSCI USA ETF,Equity,852.76M
PAK,Global X MSCI Pakistan ETF,Equity,13.38M
PALC,Pacer Lunt Large Cap Multi-Factor Alternator ETF,Equity,224.84M
PALL,Aberdeen Standard Physical Palladium Shares ETF,Commodity,288.98M
PAMC,Pacer Lunt Mid Cap Multi-Factor Alternator ETF,Equity,36.79M
PAPR,Innovator S&P 500 Power Buffer ETF (April),Equity,303.89M
PAUG,Innovator S&P 500 Power Buffer ETF (August),Equity,459.55M
PAVE,Global X U.S. Infrastructure Development ETF,Equity,3.58B
PAWZ,ProShares Pet Care ETF,Equity,107.36M
PBD,Invesco Global Clean Energy ETF,Equity,204.20M
PBDC,Putnam BDC Income ETF,Equity,6.21M
PBDM,Invesco PureBeta FTSE Developed ex-North America ETF,Equity,84.78M
PBE,Invesco Dynamic Biotechnology & Genome ETF,Equity,249.01M
PBEE,Invesco PureBeta FTSE Emerging Markets ETF,Equity,15.56M
PBJ,Invesco Dynamic Food & Beverage ETF,Equity,366.92M
PBL,PGIM Portfolio Ballast ETF,Asset Allocation,24.81M
PBND,Invesco PureBeta US Aggregate Bond ETF,Fixed Income,76.59M
PBP,Invesco S&P 500 BuyWrite ETF,Equity,117.72M
PBS,Invesco Dynamic Media ETF,Equity,34.23M
PBSM,Invesco PureBeta MSCI USA Small Cap ETF,Equity,31.66M
PBTP,Invesco PureBeta 0-5 Yr US TIPS ETF,Fixed Income,108.39M
PBUS,Invesco PureBeta MSCI USA ETF,Equity,2.19B
PBW,Invesco WilderHill Clean Energy ETF,Equity,765.00M
PCEF,Invesco CEF Income Composite ETF,Asset Allocation,670.67M
PCY,Invesco Emerging Markets Sovereign Debt ETF,Fixed Income,1.68B
PDBA,Invesco Agriculture Commodity Strategy No K-1 ETF,Commodity,14.45M
PDBC,Invesco Optimum Yield Diversified Commodity Strategy No K-1 ETF,Commodity,5.80B
PDEC,Innovator S&P 500 Power Buffer ETF (December),Equity,615.96M
PDN,Invesco FTSE RAFI Developed Markets ex-U.S. Small-Mid ETF,Equity,560.65M
PDP,Invesco DWA Momentum ETF,Equity,1.04B
PEJ,Invesco Dynamic Leisure and Entertainment ETF,Equity,450.29M
PEX,ProShares Global Listed Private Equity ETF,Equity,11.52M
PEXL,Pacer US Export Leaders ETF,Equity,11.34M
PEY,Invesco High Yield Equity Dividend Achievers ETF,Equity,1.55B
PEZ,Invesco DWA Consumer Cyclicals Momentum ETF,Equity,23.80M
PFEB,Innovator S&P 500 Power Buffer ETF (February),Equity,228.17M
PFEL,AXS 2X PFE Bull Daily ETF,Equity,1.48M
PFES,AXS 2X PFE Bear Daily ETF,Equity,1.77M
PFF,iShares Preferred and Income Securities ETF,Fixed Income,13.32B
PFFA,Virtus InfraCap US Preferred Stock ETF,Fixed Income,483.00M
PFFD,Global X U.S. Preferred ETF,Fixed Income,2.22B
PFFR,InfraCap REIT Preferred ETF,Fixed Income,56.86M
PFFV,Global X Variable Rate Preferred ETF,Fixed Income,272.61M
PFI,Invesco DWA Financial Momentum ETF,Equity,60.64M
PFIG,Invesco Fundamental Investment Grade Corporate Bond ETF,Fixed Income,38.04M
PFIX,Simplify Interest Rate Hedge ETF,Alternatives,362.23M
PFLD,AAM Low Duration Preferred and Income Securities ETF,Fixed Income,176.95M
PFM,Invesco Dividend Achievers ETF,Equity,708.50M
PFRL,PGIM Floating Rate Income ETF,Fixed Income,49.82M
PFUT,Putnam Sustainable Future ETF,Equity,7.18M
PFXF,VanEck Vectors Preferred Securities ex Financials ETF,Fixed Income,939.08M
PGAL,Global X FTSE Portugal 20 ETF,Equity,15.07M
PGF,Invesco Financial Preferred ETF,Fixed Income,1.15B
PGHY,Invesco Global Short Term High Yield Bond ETF,Fixed Income,189.55M
PGJ,Invesco Golden Dragon China ETF,Equity,243.18M
PGRO,Putnam Focused Large Cap Growth ETF,Equity,9.34M
PGX,Invesco Preferred ETF,Fixed Income,4.77B
PHB,Invesco Fundamental High Yield Corporate Bond ETF,Fixed Income,750.05M
PHDG,Invesco S&P 500 Downside Hedged ETF,Equity,252.81M
PHO,Invesco Water Resources ETF,Equity,1.73B
PHYL,PGIM Active High Yield Bond ETF,Fixed Income,87.18M
PICB,Invesco International Corporate Bond ETF,Fixed Income,114.55M
PICK,iShares MSCI Global Metals & Mining Producers ETF,Equity,1.39B
PID,Invesco International Dividend Achievers ETF,Equity,914.06M
PIE,Invesco DWA Emerging Markets Momentum ETF,Equity,151.72M
PIFI,Clearshares Piton Intermediate Fixed Income ETF,Fixed Income,126.87M
PILL,Direxion Daily Pharmaceutical & Medical Bull 3X Shares,Equity,9.62M
PIN,Invesco India ETF,Equity,91.31M
PINK,Simplify Health Care ETF,Equity,57.41M
PIO,Invesco Global Water ETF,Equity,273.54M
PIT,VanEck Commodity Strategy ETF,null,-
PIZ,Invesco DWA Developed Markets Momentum ETF,Equity,126.31M
PJAN,Innovator S&P 500 Power Buffer ETF (January),Equity,389.17M
PJFG,PGIM Jennison Focused Growth ETF,Equity,9.78M
PJFV,PGIM Jennison Focused Value ETF,Equity,10.31M
PJP,Invesco Dynamic Pharmaceuticals ETF,Equity,330.79M
PJUL,Innovator S&P 500 Power Buffer ETF (July),Equity,520.86M
PJUN,Innovator S&P 500 Power Buffer ETF (June),Equity,355.68M
PKB,Invesco Dynamic Building & Construction ETF,Equity,105.65M
PKW,Invesco BuyBack Achievers ETF,Equity,1.54B
PLAT,WisdomTree Modern Tech Platforms Fund,Equity,7.96M
PLDR,Putnam Sustainable Leaders ETF,Equity,5.97M
PLRG,Principal U.S. Large-Cap Adaptive Multi-Factor ETF,Equity,5.71M
PLTL,Principal U.S. Small-Cap Adaptive Multi-Factor ETF,Equity,5.60M
PLTM,GraniteShares Platinum Trust,Commodity,49.00M
PLW,Invesco 1-30 Laddered Treasury ETF,Fixed Income,518.13M
PMAR,Innovator S&P 500 Power Buffer ETF (March),Equity,221.33M
PMAY,Innovator S&P 500 Power Buffer ETF (May),Equity,352.46M
PNOV,Innovator S&P 500 Buffer ETF (November),Equity,798.86M
PNQI,Invesco NASDAQ Internet ETF,Equity,447.13M
POCT,Innovator S&P 500 Power Buffer ETF (October),Equity,660.52M
POTX,Global X Cannabis ETF,Equity,43.36M
PP,The Meet Kevin Pricing Power ETF,Equity,9.57M
PPA,Invesco Aerospace & Defense ETF,Equity,1.69B
PPH,VanEck Vectors Pharmaceutical ETF,Equity,594.15M
PPI,AXS Astoria Inflation Sensitive ETF,Alternatives,60.82M
PPLT,Aberdeen Standard Physical Platinum Shares ETF,Commodity,1.15B
PPTY,U.S. Diversified Real Estate ETF,Equity,113.38M
PQDI,Principal Spectrum Tax-Advantaged Dividend Active ETF,Fixed Income,20.88M
PQIN,PGIM QMA Strategic Alpha International Equity ETF,Equity,33.72M
PRAY,FIS Biblically Responsible Risk Managed ETF,Equity,20.51M
PREF,Principal Spectrum Preferred Securities Active ETF,Fixed Income,454.70M
PRF,Invesco FTSE RAFI US 1500 Small- Mid ETF,Equity,5.85B
PRFZ,Invesco FTSE RAFI US 1500 Small- Mid ETF,Equity,1.94B
PRN,Invesco DWA Industrials Momentum ETF,Equity,98.91M
PRNT,The 3D Printing ETF,Equity,177.40M
PSC,Principal U.S. Small Cap Index ETF,Equity,233.78M
PSCC,Invesco S&P SmallCap Consumer Staples ETF,Equity,60.72M
PSCD,Invesco S&P SmallCap Consumer Discretionary ETF,Equity,24.45M
PSCE,Invesco S&P SmallCap Energy ETF,Equity,123.58M
PSCF,Invesco S&P SmallCap Financials ETF,Equity,29.12M
PSCH,Invesco S&P SmallCap Health Care ETF,Equity,319.21M
PSCI,Invesco S&P SmallCap Industrials ETF,Equity,69.70M
PSCJ,Pacer Swan SOS Conservative (July) ETF,Equity,6.28M
PSCM,Invesco S&P SmallCap Materials ETF,Equity,17.63M
PSCQ,Pacer Swan SOS Conservative (October) ETF,Equity,5.04M
PSCT,Invesco S&P SmallCap Information Technology ETF,Equity,294.44M
PSCU,Invesco S&P SmallCap Utilities ETF,Equity,20.42M
PSCW,Pacer Swan SOS Conservative April ETF,Equity,15.98M
PSCX,Pacer Swan SOS Conservative (December) ETF,Equity,12.00M
PSDN,AdvisorShares Poseidon Dynamic Cannabis ETF,Equity,3.32M
PSEP,Innovator S&P 500 Power Buffer ETF (September),Equity,588.73M
PSET,Principal Price Setters Index ETF,Equity,27.51M
PSFD,Pacer Swan SOS Flex (December) ETF,Equity,14.36M
PSFF,Pacer Swan SOS Fund of Funds ETF,Equity,119.08M
PSFJ,Pacer Swan SOS Flex (July) ETF,Equity,12.54M
PSFM,Pacer Swan SOS Flex April ETF,Equity,12.58M
PSFO,Pacer Swan SOS Flex (October) ETF,Equity,9.72M
PSI,Invesco Dynamic Semiconductors ETF,Equity,471.69M
PSIL,AdvisorShares Psychedelics ETF,Equity,6.38M
PSJ,Invesco Dynamic Software ETF,Equity,180.76M
PSK,SPDR Wells Fargo Preferred Stock ETF,Fixed Income,985.29M
PSL,Invesco DWA Consumer Staples Momentum ETF,Equity,141.27M
PSMB,Invesco Balanced Multi-Asset Allocation ETF,Asset Allocation,38.88M
PSMC,Invesco Conservative Multi-Asset Allocation ETF,Asset Allocation,14.87M
PSMD,Pacer Swan SOS Moderate (December) ETF,Equity,20.95M
PSMG,Invesco Growth Multi-Asset Allocation ETF,Asset Allocation,36.43M
PSMJ,Pacer Swan SOS Moderate (July) ETF,Equity,34.77M
PSMM,Invesco Moderately Conservative Multi-Asset Allocation ETF,Asset Allocation,26.92M
PSMO,Pacer Swan SOS Moderate (October) ETF,Equity,24.54M
PSMR,Pacer Swan SOS Moderate April ETF,Equity,17.55M
PSP,Invesco Global Listed Private Equity ETF,Equity,230.31M
PSQ,ProShares Short QQQ,Equity,1.66B
PSR,Invesco Active U.S. Real Estate ETF,Equity,143.59M
PST,ProShares UltraShort 7-10 Year Treasury,Fixed Income,54.15M
PSTP,Innovator Power Buffer Step-Up Strategy ETF,Equity,40.38M
PSYK,PSYK ETF,Equity,1.84M
PTBD,Pacer Trendpilot US Bond ETF,Fixed Income,292.28M
PTEU,Pacer Trendpilot European Index ETF,Equity,41.25M
PTF,Invesco DWA Technology Momentum ETF,Equity,199.94M
PTH,Invesco DWA Healthcare Momentum ETF,Equity,217.29M
PTIN,Pacer Trendpilot International ETF,Equity,110.34M
PTLC,Pacer Trendpilot 750 ETF,Equity,2.10B
PTMC,Pacer Trendpilot 450 ETF,Equity,399.92M
PTNQ,Pacer Trendpilot 100 ETF,Equity,666.66M
PTRB,PGIM Total Return Bond ETF,Fixed Income,70.13M
PUI,Invesco DWA Utilities Momentum ETF,Equity,46.65M
PULS,PGIM Ultra Short Bond ETF,Fixed Income,3.88B
PUNK,Subversive Metaverse ETF,Equity,842.90K
PUTW,WisdomTree CBOE S&P 500 PutWrite Strategy Fund,Equity,100.88M
PVAL,Putnam Focused Large Cap Value ETF,Equity,136.78M
PVI,Invesco VRDO Tax-Free Weekly ETF,Fixed Income,77.33M
PWB,Invesco Dynamic Large Cap Growth ETF,Equity,554.03M
PWC,Invesco Dynamic Market ETF,Equity,93.00M
PWS,Pacer WealthShield ETF,Asset Allocation,29.96M
PWV,Invesco Dynamic Large Cap Value ETF,Equity,833.53M
PWZ,Invesco California AMT-Free Municipal Bond ETF,Fixed Income,571.83M
PXE,Invesco Dynamic Energy Exploration & Production ETF,Equity,291.83M
PXF,Invesco FTSE RAFI Developed Markets ex-U.S. ETF,Equity,1.29B
PXH,Invesco FTSE RAFI Emerging Markets ETF,Equity,1.27B
PXI,Invesco DWA Energy Momentum ETF,Equity,237.27M
PXJ,Invesco Dynamic Oil & Gas Services ETF,Equity,68.68M
PXQ,Invesco Dynamic Networking ETF,Equity,37.26M
PXUS,Principal International Adaptive Multi-Factor ETF,Equity,12.36M
PY,Principal Shareholder Yield Index ETF,Equity,57.46M
PYPS,AXS 1.5X PYPL Bear Daily ETF,Equity,1.69M
PYPT,AXS 1.5X PYPL Bull Daily ETF,Equity,1.10M
PYZ,Invesco DWA Basic Materials Momentum ETF,Equity,149.44M
PZA,Invesco National AMT-Free Municipal Bond ETF,Fixed Income,2.00B
PZT,Invesco New York AMT-Free Municipal Bond ETF,Fixed Income,89.45M
QABA,First Trust NASDAQ ABA Community Bank Index Fund,Equity,175.54M
QAI,IQ Hedge Multi-Strategy Tracker ETF,Alternatives,633.48M
QARP,Xtrackers Russell 1000 US QARP ETF,Equity,9.19M
QAT,iShares MSCI Qatar ETF,Equity,75.24M
QCLN,First Trust NASDAQ Clean Edge Green Energy Index Fund,Equity,1.56B
QCLR,Global X Nasdaq 100 Collar 95-110 ETF,Equity,2.90M
QCON,American Century Quality Convertible Securities ETF,Fixed Income,19.53M
QDEC,FT Cboe Vest Growth-100 Buffer ETF (December),Equity,111.60M
QDEF,FlexShares Quality Divided Defensive Index Fund,Equity,349.31M
QDF,FlexShares Quality Dividend Index Fund,Equity,1.54B
QDIV,Global X S&P 500 Quality Dividend ETF,Equity,60.38M
QDPL,Pacer Metaurus US Large Cap Dividend Multiplier 400 ETF,Asset Allocation,86.09M
QDYN,FlexShares Quality Dividend Dynamic Index Fund,Equity,16.63M
QED,IQ Hedge Event-Driven Tracker ETF,Alternatives,6.06M
QEFA,SPDR MSCI EAFE StrategicFactors ETF,Equity,901.99M
QEMM,SPDR MSCI Emerging Markets StrategicFactors ETF,Equity,41.52M
QGRO,American Century STOXX U.S. Quality Growth ETF,Equity,275.82M
QGRW,WisdomTree U.S. Quality Growth Fund,Equity,1.17M
QID,ProShares UltraShort QQQ,Equity,496.64M
QINT,American Century Quality Diversified International ETF,Equity,211.50M
QJUN,FT Cboe Vest Growth-100 Buffer ETF - June,Equity,-
QLC,FlexShares US Quality Large Cap Index Fund,Equity,119.81M
QLD,ProShares Ultra QQQ,Equity,2.32B
QLS,IQ Hedge Long/Short Tracker ETF,Alternatives,21.75M
QLTA,iShares AAA - A Rated Corporate Bond ETF,Fixed Income,743.76M
QLV,FlexShares US Quality Low Volatility Index Fund,Equity,165.63M
QLVD,FlexShares Developed Markets ex-US Quality Low Volatility Index Fund,Equity,74.61M
QLVE,FlexShares Emerging Markets Quality Low Volatility Index Fund,Equity,8.91M
QMAR,FT Cboe Vest Growth-100 Buffer ETF - March,Equity,41.56M
QMN,IQ Hedge Market Neutral Tracker ETF,Alternatives,7.36M
QMOM,MomentumShares U.S. Quantitative Momentum ETF,Equity,128.12M
QPFF,American Century Quality Preferred ETF,Fixed Income,22.28M
QPX,AdvisorShares Q Dynamic Growth ETF,Asset Allocation,28.60M
QQC,Simplify Growth Equity PLUS Convexity ETF,Equity,3.46M
QQD,Simplify Growth Equity PLUS Downside Convexity ETF,Equity,6.19M
QQEW,First Trust NASDAQ-100 Equal Weighted Index Fund,Equity,1.10B
QQH,HCM Defender 100 Index ETF,Equity,231.74M
QQJG,Invesco ESG NASDAQ Next Gen 100 ETF,Equity,3.26M
QQMG,Invesco ESG NASDAQ 100 ETF,Equity,9.02M
QQQ,Invesco QQQ Trust,Equity,145.61B
QQQA,ProShares Nasdaq-100 Dorsey Wright Momentum ETF,Equity,10.83M
QQQE,Direxion NASDAQ-100 Equal Weighted Index Shares,Equity,432.75M
QQQJ,Invesco NASDAQ Next Gen 100 ETF,Equity,765.33M
QQQM,Invesco NASDAQ 100 ETF,Equity,5.63B
QQQN,VictoryShares Nasdaq Next 50 ETF,Equity,93.48M
QQQS,Invesco NASDAQ Future Gen 200 ETF,Equity,4.70M
QQXT,First Trust NASDAQ-100 Ex-Technology Sector Index Fund,Equity,135.11M
QRFT,QRAFT AI Enhanced U.S. Large Cap ETF,Equity,4.64M
QRMI,Global X Nasdaq 100 Risk Managed Income ETF,Equity,8.65M
QSPT,FT Cboe Vest Nasdaq-100 Buffer ETF - September,Equity,74.08M
QSWN,Amplify BlackSwan Tech & Treasury ETF,Asset Allocation,2.28M
QTAP,Innovator Growth Accelerated Plus ETF,Equity,4.45M
QTEC,First Trust NASDAQ-100 Technology Sector Index Fund,Equity,1.37B
QTJA,Innovator Growth Accelerated Plus ETF - January,Equity,3.35M
QTJL,Innovator Growth Accelerated Plus ETF (July),Equity,14.64M
QTOC,Innovator Growth Accelerated Plus ETF (Oct),Equity,8.65M
QTR,Global X Nasdaq 100 Tail Risk ETF,Equity,1.43M
QTUM,Defiance Quantum ETF,Equity,103.95M
QUAL,iShares Edge MSCI USA Quality Factor ETF,Equity,17.51B
QUS,SPDR MSCI USA StrategicFactors ETF,Equity,909.97M
QVAL,U.S. Quantitative Value ETF,Equity,215.67M
QVML,Invesco S&P 500 QVM Multi-factor ETF,Equity,719.46M
QVMM,Invesco S&P MidCap 400 QVM Multi-factor ETF,Equity,251.38M
QVMS,Invesco S&P SmallCap 600 QVM Multi-factor ETF,Equity,98.32M
QVOY,Q3 All-Season Active Rotation ETF (QVOY),Asset Allocation,50.42M
QWLD,SPDR MSCI World StrategicFactors ETF,Equity,68.59M
QYLD,Horizons NASDAQ 100 Covered Call ETF,Equity,6.34B
QYLG,Global X Nasdaq 100 Covered Call & Growth ETF,Equity,61.05M
RAAX,VanEck Vectors Real Asset Allocation ETF,Alternatives,137.19M
RAFE,PIMCO RAFI ESG U.S. ETF,Equity,28.19M
RATE,Global X Interest Rate Hedge ETF,Alternatives,3.35M
RAVI,FlexShares Ready Access Variable Income FundBarclays ETN Schiller CAPE ETN,Fixed Income,878.47M
RAYC,Rayliant Quantamental China Equity ETF,Equity,95.81M
RAYD,Rayliant Quantitative Developed Market Equity ETF,Equity,17.40M
RAYE,Rayliant Quantamental Emerging Market Equity ETF,Equity,19.00M
RAYS,Global X Solar ETF,Equity,4.51M
RBLD,First Trust Alerian US NextGen Infrastructure ETF,Equity,7.26M
RBND,SPDR Bloomberg SASB Corporate Bond ESG Select ETF,Fixed Income,22.48M
RCD,Invesco S&P 500 Equal Weight Consumer Discretionary ETF,Equity,468.64M
RDFI,Rareview Dynamic Fixed Income ETF,Fixed Income,42.41M
RDIV,Invesco S&P Ultra Dividend Revenue ETF,Equity,1.02B
RDMX,SPDR Bloomberg SASB Developed Markets Ex US ESG Select ETF,Equity,9.63M
RDOG,ALPS REIT Dividend Dogs ETF,Equity,19.39M
RDVI,FT Cboe Vest Rising Dividend Achievers Target Income ETF,Equity,17.23M
RDVY,First Trust NASDAQ Rising Dividend Achievers ETF,Equity,7.92B
RECS,Columbia Research Enhanced Core ETF,Equity,56.56M
REET,iShares Global REIT ETF,Equity,2.99B
REGL,ProShares S&P MidCap 400 Dividend Aristocrats ETF,Equity,1.62B
REIT,ALPS Active REIT ETF,Equity,17.22M
REK,ProShares Short Real Estate,Equity,64.48M
REM,iShares Mortgage Real Estate ETF,Equity,643.30M
REMG,SPDR Bloomberg SASB Emerging Markets ESG Select ETF,Equity,9.23M
REMX,VanEck Vectors Rare Earth/Strategic Metals ETF,Equity,641.23M
RENW,Harbor Energy Transition Strategy ETF,Commodity,20.72M
RESD,WisdomTree Dynamic Currency Hedged International Quality Dividend Growth Fund,Equity,7.73M
RESE,WisdomTree Emerging Markets Dividend Fund,Equity,25.28M
RESI,Kelly Residential & Apartment Real Estate ETF,Equity,302.50K
RESP,WisdomTree Total Earnings Fund,Equity,67.11M
RETL,Direxion Daily Retail Bull 3X Shares,Equity,45.67M
REVS,Columbia Research Enhanced Value ETF,Equity,21.55M
REW,ProShares UltraShort Technology,Equity,14.70M
REZ,iShares Residential Real Estate Capped ETF,Equity,653.16M
RFCI,RiverFront Dynamic Core Income ETF,Fixed Income,40.69M
RFDA,RiverFront Dynamic US Dividend Advantage ETF,Equity,82.52M
RFDI,First Trust RiverFront Dynamic Developed International ETF,Equity,126.53M
RFEM,First Trust RiverFront Dynamic Emerging Markets ETF,Equity,30.96M
RFEU,First Trust RiverFront Dynamic Europe ETF,Equity,8.58M
RFFC,RiverFront Dynamic US Flex-Cap ETF,Equity,26.16M
RFG,Invesco S&P MidCap 400 Pure Growth ETF,Equity,253.25M
RFV,Invesco S&P MidCap 400 Pure Value ETF,Equity,188.94M
RGI,Invesco S&P 500 Equal Weight Industrials ETF,Equity,322.28M
RHCB,BNY Mellon Responsible Horizons Corporate Bond ETF,Fixed Income,22.43M
RHRX,RH Tactical Rotation ETF,Asset Allocation,24.56M
RHS,Invesco S&P 500 Equal Weight Consumer Staples ETF,Equity,695.66M
RHTX,RH Tactical Outlook ETF,Asset Allocation,21.71M
RIET,Hoya Capital High Dividend Yield ETF,Equity,27.66M
RIGS,Riverfront Strategic Income Fund,Fixed Income,103.30M
RIGZ,Viridi Cleaner Energy Crypto-Mining & Semiconductor ETF,Equity,2.56M
RINF,ProShares Inflation Expectations ETF,Alternatives,70.26M
RING,iShares MSCI Global Gold Miners ETF,Equity,433.07M
RISN,Inspire Tactical Balanced ESG ETF,Asset Allocation,105.75M
RISR,FolioBeyond Rising Rates ETF,Fixed Income,84.57M
RITA,ETFB Green SRI REITs ETF,Equity,11.86M
RLY,SPDR SSGA Multi-Asset Real Return ETF,Alternatives,612.39M
RNDM,First Trust Developed International Equity Select ET,Equity,18.56M
RNDV,First Trust US Equity Dividend Select ETF,Equity,24.17M
RNEM,First Trust Emerging Markets Equity Select ETF,Equity,8.61M
RNEW,VanEck Green Infrastructure ETF,Equity,1.21M
